{
  "$schema": "https://json-schema.org/draft/2020-12/schema",
  "title": "ReviewCoordinatorOutput",
  "type": "object",
  "additionalProperties": false,
  "properties": {
    "schema_version": {
      "type": "string",
      "const": "7.0"
    },
    "run_id": {
      "type": "string",
      "format": "uuid"
    },
    "agent_name": {
      "type": "string"
    },
    "status": {
      "type": "string",
      "enum": [
        "succeeded",
        "failed",
        "needs_input",
        "degraded"
      ]
    },
    "confidence": {
      "type": "number",
      "minimum": 0,
      "maximum": 1
    },
    "reasoning_summary": {
      "type": "string"
    },
    "warnings": {
      "type": "array",
      "items": {
        "type": "string"
      },
      "minItems": 0
    },
    "requires_human_review": {
      "type": "boolean"
    },
    "completed_at": {
      "type": "string",
      "format": "date-time"
    },
    "review_id": {
      "type": "string",
      "format": "uuid"
    },
    "outcome": {
      "type": "string",
      "enum": [
        "pass",
        "revise",
        "reject",
        "human_review"
      ]
    },
    "dimension_results": {
      "type": "array",
      "items": {
        "type": "object",
        "additionalProperties": true
      },
      "minItems": 1
    },
    "blocking_issues": {
      "type": "array",
      "items": {
        "$schema": "https://json-schema.org/draft/2020-12/schema",
        "title": "ReviewIssue",
        "type": "object",
        "additionalProperties": false,
        "properties": {
          "issue_id": {
            "type": "string"
          },
          "severity": {
            "type": "string",
            "enum": [
              "info",
              "low",
              "medium",
              "high",
              "critical"
            ]
          },
          "category": {
            "type": "string"
          },
          "description": {
            "type": "string"
          },
          "location": {
            "anyOf": [
              {
                "type": "string"
              },
              {
                "type": "null"
              }
            ]
          },
          "evidence_ids": {
            "type": "array",
            "items": {
              "type": "string",
              "format": "uuid"
            },
            "minItems": 0
          },
          "repair_instruction": {
            "anyOf": [
              {
                "type": "string"
              },
              {
                "type": "null"
              }
            ]
          }
        },
        "required": [
          "issue_id",
          "severity",
          "category",
          "description",
          "location",
          "evidence_ids",
          "repair_instruction"
        ]
      },
      "minItems": 0
    },
    "repair_instructions": {
      "type": "array",
      "items": {
        "type": "string"
      },
      "minItems": 0
    },
    "rerun_branches": {
      "type": "array",
      "items": {
        "type": "string",
        "enum": [
          "retrieval",
          "explanation",
          "practice",
          "quiz",
          "assessment"
        ]
      },
      "minItems": 0
    },
    "approved_evidence_ids": {
      "type": "array",
      "items": {
        "type": "string",
        "format": "uuid"
      },
      "minItems": 0
    }
  },
  "required": [
    "schema_version",
    "run_id",
    "agent_name",
    "status",
    "confidence",
    "reasoning_summary",
    "warnings",
    "requires_human_review",
    "completed_at",
    "review_id",
    "outcome",
    "dimension_results",
    "blocking_issues",
    "repair_instructions",
    "rerun_branches",
    "approved_evidence_ids"
  ]
}
